{
  "id": "atom_exp_claude-skill-over-mcp-for-local-sovereignty_1728443200",
  "kind": "experience",
  "schemaVersion": 1,
  "name": "本地主权优先于跨协议通用：Claude Skill > MCP Server",
  "sourceAgent": "claude-code",
  "sourceContext": "CCL Atlas V1.5 Step 3 OST 会话中，裁决 Gap-2（Agent 双向接口）的技术路线。初版推荐 MCP Server，用户基于本地主权哲学翻盘选择 Claude Skill 原生格式。",
  "insight": "在本地优先、用户主权哲学的产品里，Claude Skill 原生格式优于 MCP Server，即使后者是跨 agent 的协议标准。四层原因：(1) Skill 就是文件——SKILL.md + 可选的 helper script，用户可以看、可以改、可以版本化；MCP Server 是服务抽象，对用户是黑盒。(2) 实现复杂度 Skill 格式低 4 倍——无需 stdio/HTTP 服务、无需进程管理、无需端口管理、无需后台保活。(3) Claude Skill 格式正在成为事实标准，短期跨 agent 支持会变好；而 MCP 的护城河会在 1-2 年内被 skill 生态蚕食。(4) 文件=主权=透明，服务=抽象=黑盒，两者哲学方向相反，Skill 与 CCL Atlas 的产品 DNA（反 SaaS 锁定、反数据垄断）完全对齐。代价是 V1.5 只支持 Claude Code 原生集成，Cursor/Codex/Trae 等延后到 V1.6 通过 MCP 薄层适配。这个 trade-off 是可接受的：一个 agent 跑通四幕 demo > 三个 agent 都半跑通。",
  "keySteps": [
    "判断产品 DNA 是'本地主权' → 文件形态优先于服务形态",
    "先出货单 agent 跑通 > 多 agent 半跑通（Dogfooding 效率优先）",
    "V1.6 MCP 薄层可直接复用 V1.5 的 read/write helper CLI 实现",
    "不要为了'通用性'牺牲'可见性'——透明度是一等公民",
    "遇到'跨协议标准 vs 本地文件'的二选一时，回问：这个产品是不是在对抗中心化？如果是，选文件"
  ],
  "tags": [
    "architecture-decision",
    "local-first",
    "claude-skill",
    "mcp",
    "v1.5-scoping",
    "sovereignty-design"
  ],
  "relatedFrameworks": [
    "agent-development"
  ],
  "createdAt": "2026-04-08T21:00:00+08:00",
  "updatedAt": "2026-04-08T11:20:48.803Z",
  "stats": {
    "usedInProjects": [],
    "useCount": 0
  }
}
